{
  "name": "Schema.org — LocalBusiness",
  "description": "Local businesses, opening hours, reviews, and postal addresses — a subset of Schema.org for describing brick-and-mortar businesses and their services.",
  "icon": "🏪",
  "category": "retail",
  "tags": [
    "schema-org",
    "local-business",
    "review",
    "structured-data",
    "seo"
  ],
  "author": "Schema.org (adapted)",
  "license": "CC-BY-SA-3.0",
  "sourceUrl": "https://schema.org/version/latest/schemaorg-current-https.rdf"
}
