{
  "name": "FIBO 风险实验室 — 第 2 步：地理层级",
  "description": "加入地区、国家与管辖区，并标注灾害区，用于地理风险分析。",
  "icon": "🌍",
  "category": "school",
  "tags": [
    "fibo",
    "risk",
    "geography",
    "school",
    "step-2"
  ],
  "author": "EDM Council FIBO (adapted by ontology-quest)",
  "license": "MIT",
  "sourceUrl": "https://github.com/edmcouncil/fibo"
}
