{
  "name": "Schema.org — MedicalEntity",
  "description": "Medical conditions, drugs, procedures, and healthcare providers — a health-domain subset of Schema.org.",
  "category": "healthcare",
  "author": "Schema.org (adapted)",
  "tags": ["schema-org", "medical", "health", "drug", "hospital"],
  "license": "CC-BY-SA-3.0",
  "sourceUrl": "https://schema.org/version/latest/schemaorg-current-https.rdf"
}
