{
  "name": "Brick Schema 1.4.4",
  "description": "The BSD-licensed Brick ontology for describing buildings, equipment, points, locations, systems, and their relationships.",
  "icon": "🧱",
  "category": "technology",
  "tags": ["buildings", "iot", "building-automation", "schema", "open-source"],
  "author": "Brick Consortium",
  "license": "BSD-3-Clause",
  "sourceUrl": "https://github.com/BrickSchema/Brick/tree/v1.4.4",
  "version": "1.4.4"
}
